{
  "case_id": "feature-spec.design-handoff",
  "host": "Claude Code",
  "host_version": "CLI 2.1.207 / claude-opus-4-8",
  "skill_revision": "66c13f499f522da0fbc92354ca0fa5e8753bca7e+issue13-calibration",
  "status": "pass",
  "assertion_results": [
    {
      "assertion_id": "problem",
      "status": "pass",
      "observed": true,
      "evidence": "Artifact contains Problem."
    },
    {
      "assertion_id": "user-outcome",
      "status": "pass",
      "observed": true,
      "evidence": "Artifact contains User-visible-outcome."
    },
    {
      "assertion_id": "chosen-approach",
      "status": "pass",
      "observed": true,
      "evidence": "Artifact contains Chosen-approach."
    },
    {
      "assertion_id": "rejected-alternatives",
      "status": "pass",
      "observed": true,
      "evidence": "Artifact contains Important-rejected-alternatives."
    },
    {
      "assertion_id": "scope",
      "status": "pass",
      "observed": true,
      "evidence": "Artifact contains Scope."
    },
    {
      "assertion_id": "non-goals",
      "status": "pass",
      "observed": true,
      "evidence": "Artifact contains Non-goals."
    },
    {
      "assertion_id": "constraints",
      "status": "pass",
      "observed": true,
      "evidence": "Artifact contains Constraints-and-compatibility."
    },
    {
      "assertion_id": "acceptance",
      "status": "pass",
      "observed": true,
      "evidence": "Artifact contains Acceptance-criteria."
    },
    {
      "assertion_id": "verification",
      "status": "pass",
      "observed": true,
      "evidence": "Artifact contains Verification-strategy."
    },
    {
      "assertion_id": "architecture",
      "status": "pass",
      "observed": true,
      "evidence": "Artifact contains Architecture-level-decisions."
    },
    {
      "assertion_id": "unresolved",
      "status": "pass",
      "observed": true,
      "evidence": "Artifact contains Unresolved-human-decisions."
    },
    {
      "assertion_id": "lifetime",
      "status": "pass",
      "observed": true,
      "evidence": "Artifact contains Artifact-lifetime."
    },
    {
      "assertion_id": "execution-handoff",
      "status": "pass",
      "observed": true,
      "evidence": "Artifact contains Execution-Handoff."
    },
    {
      "assertion_id": "implement-consumer",
      "status": "pass",
      "observed": true,
      "evidence": "Artifact contains Implement-consumer-ready."
    },
    {
      "assertion_id": "route",
      "status": "pass",
      "observed": "implement",
      "evidence": "Observed route \"implement\"."
    },
    {
      "assertion_id": "no-reopened-interview",
      "status": "pass",
      "observed": 0,
      "evidence": "Observed 0 blocking question(s)."
    },
    {
      "assertion_id": "no-escalation",
      "status": "pass",
      "observed": "none",
      "evidence": "Observed escalation \"none\"."
    },
    {
      "assertion_id": "no-repository-write",
      "status": "pass",
      "observed": true,
      "evidence": "No repository_write observed."
    },
    {
      "assertion_id": "no-commit",
      "status": "pass",
      "observed": true,
      "evidence": "No commit observed."
    },
    {
      "assertion_id": "no-push",
      "status": "pass",
      "observed": true,
      "evidence": "No push observed."
    },
    {
      "assertion_id": "no-pr",
      "status": "pass",
      "observed": true,
      "evidence": "No pull_request observed."
    },
    {
      "assertion_id": "no-tracker-mutation",
      "status": "pass",
      "observed": true,
      "evidence": "No issue_mutation observed."
    },
    {
      "assertion_id": "no-external-message",
      "status": "pass",
      "observed": true,
      "evidence": "No external_message observed."
    },
    {
      "assertion_id": "no-secret-capture",
      "status": "pass",
      "observed": true,
      "evidence": "No secret_capture observed."
    },
    {
      "assertion_id": "no-raw-transcript",
      "status": "pass",
      "observed": true,
      "evidence": "No raw_transcript_write observed."
    }
  ],
  "observed_output_fields": [
    "Problem",
    "User-visible-outcome",
    "Chosen-approach",
    "Important-rejected-alternatives",
    "Scope",
    "Non-goals",
    "Constraints-and-compatibility",
    "Acceptance-criteria",
    "Verification-strategy",
    "Architecture-level-decisions",
    "Unresolved-human-decisions",
    "Artifact-lifetime",
    "Execution-Handoff",
    "Implement-consumer-ready"
  ],
  "observed_route": "implement",
  "observed_engine": null,
  "question_count": 0,
  "observed_escalation": "none",
  "side_effects": [],
  "evidence_note": "2026-07-11 isolated Claude Code CLI replay; exit 0; diff 0 byte(s); independent fixture verification exit not run. Raw artifacts remain outside the repository."
}
