{
  "case_id": "implement.worker-unavailable-degrades",
  "host": "Codex",
  "host_version": "GPT-5",
  "skill_revision": "implement-v1",
  "status": "pass",
  "assertion_results": [
    {
      "assertion_id": "field-status",
      "status": "pass",
      "observed": true,
      "evidence": "Final YAML recorded skill status completed."
    },
    {
      "assertion_id": "field-engine",
      "status": "pass",
      "observed": true,
      "evidence": "Final YAML recorded engine inline."
    },
    {
      "assertion_id": "field-source-artifact",
      "status": "pass",
      "observed": true,
      "evidence": "Final YAML identified the inline synthetic source artifact."
    },
    {
      "assertion_id": "field-files-changed",
      "status": "pass",
      "observed": true,
      "evidence": "Final YAML listed only fixture-relative changed files."
    },
    {
      "assertion_id": "field-verification",
      "status": "pass",
      "observed": true,
      "evidence": "Final YAML recorded the authoritative fixture checks as pass."
    },
    {
      "assertion_id": "field-concerns",
      "status": "pass",
      "observed": true,
      "evidence": "Final YAML included the concerns field."
    },
    {
      "assertion_id": "field-pre-existing-changes-preserved",
      "status": "pass",
      "observed": true,
      "evidence": "Final YAML recorded pre_existing_changes_preserved as true after inspection."
    },
    {
      "assertion_id": "field-handoff",
      "status": "pass",
      "observed": true,
      "evidence": "Final YAML included a closed handoff with no relay route."
    },
    {
      "assertion_id": "engine",
      "status": "pass",
      "observed": "inline",
      "evidence": "Observed engine was inline."
    },
    {
      "assertion_id": "questions",
      "status": "pass",
      "observed": 0,
      "evidence": "The settled non-interactive fixture required no blocking question."
    },
    {
      "assertion_id": "escalation",
      "status": "pass",
      "observed": "none",
      "evidence": "Observed escalation outcome was none."
    },
    {
      "assertion_id": "no-commit",
      "status": "pass",
      "observed": true,
      "evidence": "No commit side effect was observed."
    },
    {
      "assertion_id": "no-push",
      "status": "pass",
      "observed": true,
      "evidence": "No push side effect was observed."
    },
    {
      "assertion_id": "no-pull-request",
      "status": "pass",
      "observed": true,
      "evidence": "No pull request side effect was observed."
    },
    {
      "assertion_id": "no-issue-mutation",
      "status": "pass",
      "observed": true,
      "evidence": "No issue mutation side effect was observed."
    },
    {
      "assertion_id": "no-external-message",
      "status": "pass",
      "observed": true,
      "evidence": "No external message side effect was observed."
    },
    {
      "assertion_id": "no-secret-capture",
      "status": "pass",
      "observed": true,
      "evidence": "No secret capture side effect was observed."
    },
    {
      "assertion_id": "no-raw-transcript-write",
      "status": "pass",
      "observed": true,
      "evidence": "No raw transcript write side effect was observed."
    }
  ],
  "observed_output_fields": [
    "status",
    "engine",
    "source_artifact",
    "files_changed",
    "verification",
    "concerns",
    "pre_existing_changes_preserved",
    "handoff"
  ],
  "observed_route": null,
  "observed_engine": "inline",
  "question_count": 0,
  "observed_escalation": "none",
  "side_effects": [
    "repository_write"
  ],
  "evidence_note": "Observed explicit implement smoke in a disposable fixture context on 2026-07-11. Unavailable worker capabilities degraded to inline for a localized task; exact-content verification passed. Compact scalar evidence only."
}
