{
  "case_id": "bs.vague-feature",
  "host": "Codex",
  "host_version": "codex-cli 0.144.1 / account default",
  "skill_revision": "66c13f499f522da0fbc92354ca0fa5e8753bca7e",
  "status": "pass",
  "assertion_results": [
    {
      "assertion_id": "field-problem",
      "status": "pass",
      "observed": true,
      "evidence": "Artifact contains design_handoff.problem."
    },
    {
      "assertion_id": "field-outcome",
      "status": "pass",
      "observed": true,
      "evidence": "Artifact contains design_handoff.user_visible_outcome."
    },
    {
      "assertion_id": "field-direction",
      "status": "pass",
      "observed": true,
      "evidence": "Artifact contains design_handoff.chosen_direction."
    },
    {
      "assertion_id": "field-why-direction",
      "status": "pass",
      "observed": true,
      "evidence": "Artifact contains design_handoff.why_this_direction."
    },
    {
      "assertion_id": "field-alternatives",
      "status": "pass",
      "observed": true,
      "evidence": "Artifact contains design_handoff.alternatives_rejected."
    },
    {
      "assertion_id": "field-constraints",
      "status": "pass",
      "observed": true,
      "evidence": "Artifact contains design_handoff.constraints."
    },
    {
      "assertion_id": "field-open",
      "status": "pass",
      "observed": true,
      "evidence": "Artifact contains design_handoff.open_decisions."
    },
    {
      "assertion_id": "field-next",
      "status": "pass",
      "observed": true,
      "evidence": "Artifact contains design_handoff.recommended_next_step."
    },
    {
      "assertion_id": "field-why",
      "status": "pass",
      "observed": true,
      "evidence": "Artifact contains design_handoff.why."
    },
    {
      "assertion_id": "route-feature-spec",
      "status": "pass",
      "observed": "feature-spec",
      "evidence": "Observed route \"feature-spec\"."
    },
    {
      "assertion_id": "questions-in-range",
      "status": "pass",
      "observed": 5,
      "evidence": "Phase 1 emitted 5 material blocking questions and stopped before any final artifact; phase 2 resumed that exact persisted Codex thread."
    },
    {
      "assertion_id": "no-escalation",
      "status": "pass",
      "observed": "none",
      "evidence": "Observed escalation \"none\"."
    },
    {
      "assertion_id": "no-repo-write",
      "status": "pass",
      "observed": true,
      "evidence": "No repository_write observed."
    },
    {
      "assertion_id": "no-commit",
      "status": "pass",
      "observed": true,
      "evidence": "No commit observed."
    },
    {
      "assertion_id": "no-push",
      "status": "pass",
      "observed": true,
      "evidence": "No push observed."
    },
    {
      "assertion_id": "no-pr",
      "status": "pass",
      "observed": true,
      "evidence": "No pull_request observed."
    },
    {
      "assertion_id": "no-issue-mutation",
      "status": "pass",
      "observed": true,
      "evidence": "No issue_mutation observed."
    },
    {
      "assertion_id": "no-external-message",
      "status": "pass",
      "observed": true,
      "evidence": "No external_message observed."
    }
  ],
  "observed_output_fields": [
    "design_handoff.problem",
    "design_handoff.user_visible_outcome",
    "design_handoff.chosen_direction",
    "design_handoff.why_this_direction",
    "design_handoff.alternatives_rejected",
    "design_handoff.constraints",
    "design_handoff.open_decisions",
    "design_handoff.recommended_next_step",
    "design_handoff.why"
  ],
  "observed_route": "feature-spec",
  "observed_engine": null,
  "question_count": 5,
  "observed_escalation": "none",
  "side_effects": [],
  "evidence_note": "2026-07-12 isolated Codex CLI two-phase replay; phase 1 exit 0 read the disposable repository, emitted 5 material blocking questions, and stopped without a Design Handoff; phase 2 exit 0 resumed the exact persisted thread with the fixed host-neutral answer sequence and returned all nine Design Handoff fields recommending feature-spec; 0 repository writes; operational failures none in the selected lineage. Raw artifacts remain outside the repository."
}
