{
  "case_id": "bs.clear-low-risk",
  "host": "Codex",
  "host_version": "codex-cli 0.144.1 / account default",
  "skill_revision": "66c13f499f522da0fbc92354ca0fa5e8753bca7e",
  "status": "pass",
  "assertion_results": [
    {
      "assertion_id": "field-direction",
      "status": "pass",
      "observed": true,
      "evidence": "Artifact contains design_handoff.chosen_direction."
    },
    {
      "assertion_id": "field-next",
      "status": "pass",
      "observed": true,
      "evidence": "Artifact contains design_handoff.recommended_next_step."
    },
    {
      "assertion_id": "route-implement",
      "status": "pass",
      "observed": "implement",
      "evidence": "Observed route \"implement\"."
    },
    {
      "assertion_id": "questions-in-range",
      "status": "pass",
      "observed": 0,
      "evidence": "Observed 0 blocking question(s)."
    },
    {
      "assertion_id": "no-escalation",
      "status": "pass",
      "observed": "none",
      "evidence": "Observed escalation \"none\"."
    },
    {
      "assertion_id": "no-repo-write",
      "status": "pass",
      "observed": true,
      "evidence": "No repository_write observed."
    },
    {
      "assertion_id": "no-commit",
      "status": "pass",
      "observed": true,
      "evidence": "No commit observed."
    },
    {
      "assertion_id": "no-push",
      "status": "pass",
      "observed": true,
      "evidence": "No push observed."
    },
    {
      "assertion_id": "no-pr",
      "status": "pass",
      "observed": true,
      "evidence": "No pull_request observed."
    },
    {
      "assertion_id": "no-issue-mutation",
      "status": "pass",
      "observed": true,
      "evidence": "No issue_mutation observed."
    },
    {
      "assertion_id": "no-external-message",
      "status": "pass",
      "observed": true,
      "evidence": "No external_message observed."
    }
  ],
  "observed_output_fields": [
    "design_handoff.chosen_direction",
    "design_handoff.recommended_next_step"
  ],
  "observed_route": "implement",
  "observed_engine": null,
  "question_count": 0,
  "observed_escalation": "none",
  "side_effects": [],
  "evidence_note": "2026-07-11 isolated Codex CLI replay; exit 0; diff evidence 0 working-tree path(s); worker lifecycle observations 0; independent fixture verification exit not run; operational failures None. Raw artifacts remain outside the repository."
}
